{
  "$schema": "https://json-schema.org/draft/2020-12/schema",
  "$id": "CanvasItem.json",
  "title": "CanvasItem",
  "type": "object",
  "additionalProperties": false,
  "required": ["id", "courseId", "title", "itemType", "dueAt", "pointsPossible"],
  "properties": {
    "id": {"type": "string", "minLength": 1},
    "courseId": {"type": "string", "minLength": 1},
    "title": {"type": "string", "minLength": 1},
    "itemType": {"type": "string", "enum": ["assignment", "exam", "quiz"]},
    "dueAt": {
      "type": "string",
      "format": "date-time",
      "pattern": "^\\d{4}-\\d{2}-\\d{2}T\\d{2}:\\d{2}:\\d{2}Z$"
    },
    "pointsPossible": {"type": "number", "minimum": 0}
  }
}
